<?xml version="1.0" encoding="UTF-8"?>
<?xml-stylesheet type="text/css" href="mod9.css"?>

<pokedex
	xmlns:xsi="http://www.w3.org/2001/XMLSchema-instance"
	xsi:noNamespaceSchemaLocation="pokemonXMLSchema.xsd">
	<pokemon evolution-line="charmander">
		<number>0004</number>
		<name>Charmander</name>
		<type-1>Fire</type-1>
		<type-2>None</type-2>
		<home-region>Kanto</home-region>
	</pokemon>
	<pokemon evolution-line="charmander">
		<number>0005</number>
		<name>Charmeleon</name>
		<type-1>Fire</type-1>
		<type-2>None</type-2>
		<home-region>Kanto</home-region>
	</pokemon>
	<pokemon evolution-line="charmander">
		<number>0006</number>
		<name>Charizard</name>
		<type-1>Fire</type-1>
		<type-2>Flying</type-2>
		<home-region>Kanto</home-region>
	</pokemon>
</pokedex>